chat_history,question
"[{""inputs"":{""question"":""What is the most important factor in achieving success?""},""outputs"":{""answer"":""The most important factor in achieving success is to have a clear vision of what you want to achieve and set specific goals that will help you get there. You should also be willing to work hard and persevere through challenges.""}}]",How to set a reasonable and effective goal?
"[{""inputs"":{""question"":""How can we create a positive and productive work environment?""},""outputs"":{""answer"":""To create a positive and productive work environment, you should focus on building strong relationships with your colleagues, communicate effectively, and provide opportunities for growth and development.""}}]",How can you build and maintain trust with colleagues?
"[{""inputs"":{""question"":""What is the best way to stay motivated?""},""outputs"":{""answer"":""The best way to stay motivated is to set goals that are challenging but achievable, break them down into smaller tasks, and celebrate your progress along the way.""}}]",How to speed up the process of achieving the goal?
"[{""inputs"":{""question"":""How do you handle stress and pressure in the workplace?""},""outputs"":{""answer"":""To handle stress and pressure in the workplace, you should practice self-care, take breaks when needed, and seek support from colleagues or a mental health professional if necessary.""}}]",How can you relax and recover after a long workday?
"[{""inputs"":{""question"":""How do you stay organized and productive?""},""outputs"":{""answer"":""To stay organized and productive, you should prioritize your tasks, use tools like calendars and to-do lists, and minimize distractions.""}}]",How to minimize distractions?
"[{""inputs"":{""question"":""What strategies can you use to improve communication in the workplace?""},""outputs"":{""answer"":""To improve communication in the workplace, you should actively listen to others, be clear and concise in your own communication, and provide feedback when necessary.""}}]",How can I do it better?
"[{""inputs"":{""question"":""How can you effectively manage team dynamics?""},""outputs"":{""answer"":""To effectively manage team dynamics, you should establish clear roles and responsibilities, encourage collaboration, and provide opportunities for team members to give feedback.""}}]",How do you find working with the team?
"[{""inputs"":{""question"":""What are the key elements of a successful team?""},""outputs"":{""answer"":""The key elements of a successful team include clear goals, open communication, mutual respect, trust, accountability, and a shared sense of purpose.""}}]",How to better realize these elements
"[{""inputs"":{""question"":""How do you build and maintain trust with colleagues?""},""outputs"":{""answer"":""To build and maintain trust with colleagues, you should be honest and transparent in your communication, follow through on commitments, and avoid gossip or negative talk.""}}]",How to avoid negative talk?
"[{""inputs"":{""question"":""How can you handle difficult conversations in the workplace?""},""outputs"":{""answer"":""To handle difficult conversations in the workplace, you should prepare ahead of time, be clear about your goals for the conversation, listen actively to the other persons perspective, and seek common ground.""}}]",How to seek common ground?
"[{""inputs"":{""question"":""What steps should you take when resolving conflicts in the workplace?""},""outputs"":{""answer"":""When resolving conflicts in the workplace, its important to remain calm and objective, listen actively to both sides of the conflict, identify common ground or shared goals, and work together to find a solution that meets everyones needs.""}}]",How to find a solution that meets everyones needs?
"[{""inputs"":{""question"":""What is the best way to manage expectations?""},""outputs"":{""answer"":""The best way to manage expectations is to be clear about what you can deliver and when. You should also communicate any changes or delays as soon as possible.""}}]",What happens if manage expectations fail?
"[{""inputs"":{""question"":""How can you ensure that everyone is on the same page?""},""outputs"":{""answer"":""To ensure that everyone is on the same page, you should communicate clearly and regularly with your team members. You can also use tools like project management software or shared calendars to keep everyone informed.""}}]",Is there any more way I can solve this problem?
"[{""inputs"":{""question"":""How do you create a culture of accountability?""},""outputs"":{""answer"":""To create a culture of accountability, you should establish clear expectations for performance and behavior, provide regular feedback on progress toward goals, and hold yourself and others accountable for meeting those expectations.""}}]",What is the effect of creating a culture of accountability successfully?
"[{""inputs"":{""question"":""How do you promote collaboration and team-building activities?""},""outputs"":{""answer"":""To promote collaboration and team-building activities, you can organize team-building events, encourage open communication, and create a positive work environment that fosters teamwork and collaboration.""}}]",How to organize team-building events?
"[{""inputs"":{""question"":""What are some innovative ways to increase employee engagement?""},""outputs"":{""answer"":""Some innovative ways to increase employee engagement include offering flexible work arrangements, providing opportunities for professional development, and creating a culture of recognition and appreciation.""}}]",What benefits can increase employee engagement bring?
"[{""inputs"":{""question"":""How can you ensure that everyone is following the same processes and procedures?""},""outputs"":{""answer"":""To ensure that everyone is following the same processes and procedures, you can create clear guidelines and standard operating procedures (SOPs), provide training and support to employees, and monitor performance regularly.""}}]",What can I do to provide training and support to employees?
"[{""inputs"":{""question"":""How can you foster a culture of feedback and continuous improvement?""},""outputs"":{""answer"":""To foster a culture of feedback and continuous improvement, you can encourage open communication, provide regular feedback to employees, and create a safe space for employees to share their ideas and suggestions.""}}]",What are the benefits of employees to share their ideas and suggestions?
"[{""inputs"":{""question"":""How do you create an environment of openness and trust?""},""outputs"":{""answer"":""To create an environment of openness and trust, you can lead by example, be transparent in your communication, and create opportunities for employees to share their thoughts and ideas.""}}]",How to create opportunities for employees to share their thoughts and ideas?
"[{""inputs"":{""question"":""How can I improve my communication skills?""},""outputs"":{""answer"":""To improve your communication skills, you can practice active listening, ask questions to clarify your understanding, and be clear and concise in your communication.""}}]",What to do if you are afraid of communicating with others?
"[{""inputs"":{""question"":""What are the key elements of a successful business plan?""},""outputs"":{""answer"":""The key elements of a successful business plan include a clear mission statement, a detailed market analysis, a well-defined target audience, a comprehensive marketing strategy, a solid financial plan, and a realistic timeline for achieving your goals.""}}]",What is the importance of a successful business plan?
"[{""inputs"":{""question"":""What is the most effective way to manage stress?""},""outputs"":{""answer"":""The most effective way to manage stress is to practice self-care techniques such as exercise, meditation, deep breathing exercises, or taking breaks throughout the day.""}}]",Can you provide several ways of exercising?
"[{""inputs"":{""question"":""How do I build strong relationships with others?""},""outputs"":{""answer"":""To build strong relationships with others, you can practice active listening skills, show empathy and understanding towards others perspectives, be reliable and trustworthy in your interactions with others.""}}]",How to increase your affinity?
"[{""inputs"":{""question"":""How can I become more organized?""},""outputs"":{""answer"":""To become more organized, you can use tools such as calendars or task lists to keep track of your schedule or tasks. You can also prioritize tasks based on their importance or urgency.""}}]",What aspects need to be considered in organizing a party?
"[{""inputs"":{""question"":""What strategies can I use to stay focused?""},""outputs"":{""answer"":""Strategies that can help you stay focused include setting clear goals for yourself, breaking down large tasks into smaller ones, eliminating distractions such as social media or email notifications while working on important tasks.""}}]",How to set clear goals?
"[{""inputs"":{""question"":""How can I develop my leadership skills?""},""outputs"":{""answer"":""To develop your leadership skills you can practice active listening skills when interacting with others. You can also lead by example by demonstrating the qualities you want others to emulate such as honesty or integrity.""}}]",How can I improve my communication skills?
"[{""inputs"":{""question"":""How can I be more productive?""},""outputs"":{""answer"":""To be more productive you can prioritize tasks based on their importance or urgency. You can also eliminate distractions such as social media or email notifications while working on important tasks.""}}]",What can I do to lighten my workload if I have a lot of emails to manage?
"[{""inputs"":{""question"":""What are some effective ways to manage my time?""},""outputs"":{""answer"":""Effective ways to manage your time include prioritizing tasks based on their importance or urgency. You can also use tools such as calendars or task lists to keep track of your schedule or tasks.""}}]",What are the benefits of effective time management?
"[{""inputs"":{""question"":""What are the benefits of networking?""},""outputs"":{""answer"":""Benefits of networking include building relationships with others in your industry or field. This can lead to new job opportunities or collaborations on projects.""}}]",What can we do with the networking?
"[{""inputs"":{""question"":""How can I become more creative?""},""outputs"":{""answer"":""To become more creative you can try new things outside of your comfort zone. You can also surround yourself with creative people who inspire you towards new ideas.""}}]",What's the downside of lack of creativity?
